{
  "agent": "codemage",
  "engine": "xtts_v2",
  "xtts_env_python": ".venv-xtts\\Scripts\\python.exe",
  "xtts_model_dir": ".models\\coqui--XTTS-v2",
  "xtts_config": ".models\\coqui--XTTS-v2\\config.json",
  "reference_wav": "voices\\codemage\\reference.wav",
  "language": "en",
  "sample_output": "voices\\codemage\\codemage_clone_test.wav"
}
